{
  "environment": {
    "git_dirty": true,
    "git_revision": "b891172439739134ff254d76befb7c451d47f57f",
    "machine": "arm64",
    "platform": "macOS-26.5.2-arm64-arm-64bit-Mach-O",
    "python": "3.14.6",
    "timestamp": "2026-08-02T11:38:00.899890+00:00"
  },
  "measurements": [
    {
      "artifact_bytes": null,
      "cold_start_ns": 21705062,
      "first_call_ns": 3000,
      "peak_rss_bytes": null,
      "reason": null,
      "runtime": "sbcl-prepared",
      "status": "ok",
      "steady_state": {
        "samples_ns": [
          1000,
          1333,
          1000,
          667,
          1333,
          667,
          1000,
          1000,
          1000,
          1333,
          1000,
          1000,
          1333,
          667,
          1000,
          667,
          1000,
          1333,
          1000,
          1000,
          667,
          667,
          667,
          1000,
          1333,
          1000,
          1333,
          1000,
          667,
          1000
        ]
      },
      "suite": "algorithms",
      "warmup_samples_ns": [
        1000,
        1333,
        1000,
        667,
        1333
      ],
      "workload": "sieve-array"
    },
    {
      "artifact_bytes": null,
      "cold_start_ns": 21705062,
      "first_call_ns": 2404000,
      "peak_rss_bytes": null,
      "reason": null,
      "runtime": "sbcl-prepared",
      "status": "ok",
      "steady_state": {
        "samples_ns": [
          2431667,
          2435333,
          2431667,
          2451000,
          2420000,
          2402667,
          2411333,
          2410333,
          2426333,
          2407000,
          2432667,
          2420667,
          2414333,
          2449333,
          2436333,
          2436000,
          2441667,
          2438333,
          2441000,
          2441667,
          2440000,
          2441000,
          2447667,
          2440667,
          2439667,
          2436000,
          2446333,
          2446333,
          2442000,
          2444000
        ]
      },
      "suite": "algorithms",
      "warmup_samples_ns": [
        2431667,
        2435333,
        2431667,
        2451000,
        2420000
      ],
      "workload": "towers-recursive"
    },
    {
      "artifact_bytes": null,
      "cold_start_ns": 21705062,
      "first_call_ns": 450000,
      "peak_rss_bytes": null,
      "reason": null,
      "runtime": "sbcl-prepared",
      "status": "ok",
      "steady_state": {
        "samples_ns": [
          435000,
          436000,
          438000,
          434000,
          428667,
          422333,
          426000,
          429000,
          427333,
          425333,
          426667,
          423000,
          435667,
          436000,
          437667,
          438333,
          438000,
          444333,
          437667,
          434000,
          434000,
          434000,
          436000,
          435667,
          446667,
          434000,
          426333,
          435333,
          432000,
          434333
        ]
      },
      "suite": "algorithms",
      "warmup_samples_ns": [
        435000,
        436000,
        438000,
        434000,
        428667
      ],
      "workload": "queens-backtracking"
    },
    {
      "artifact_bytes": null,
      "cold_start_ns": 21705062,
      "first_call_ns": 939000,
      "peak_rss_bytes": null,
      "reason": null,
      "runtime": "sbcl-prepared",
      "status": "ok",
      "steady_state": {
        "samples_ns": [
          874333,
          930667,
          956000,
          952333,
          949000,
          928667,
          917667,
          1066333,
          833667,
          805333,
          804333,
          812667,
          813667,
          835000,
          819000,
          816667,
          811333,
          812667,
          811667,
          807000,
          805667,
          814333,
          819667,
          800667,
          807667,
          806667,
          813333,
          817000,
          812333,
          816000
        ]
      },
      "suite": "algorithms",
      "warmup_samples_ns": [
        874333,
        930667,
        956000,
        952333,
        949000
      ],
      "workload": "heap-permute"
    },
    {
      "artifact_bytes": null,
      "cold_start_ns": 21705062,
      "first_call_ns": 19367000,
      "peak_rss_bytes": null,
      "reason": null,
      "runtime": "sbcl-prepared",
      "status": "ok",
      "steady_state": {
        "samples_ns": [
          19248333,
          19172667,
          19104667,
          19107667,
          19556333,
          19084000,
          18980333,
          19323667,
          19307333,
          19232333,
          19098333,
          19046667,
          19049667,
          19508333,
          19763333,
          19032333,
          19099667,
          19132667,
          19181000,
          20247667,
          19130333,
          19018333,
          19131000,
          19112000,
          19412000,
          19583000,
          19258333,
          19247667,
          19203333,
          19049667
        ]
      },
      "suite": "algorithms",
      "warmup_samples_ns": [
        19248333,
        19172667,
        19104667,
        19107667,
        19556333
      ],
      "workload": "ackermann-deep"
    },
    {
      "artifact_bytes": null,
      "cold_start_ns": 21705062,
      "first_call_ns": 280000,
      "peak_rss_bytes": null,
      "reason": null,
      "runtime": "sbcl-prepared",
      "status": "ok",
      "steady_state": {
        "samples_ns": [
          273667,
          271000,
          273333,
          273333,
          274333,
          273000,
          273333,
          273000,
          273333,
          274667,
          269333,
          268667,
          269333,
          268667,
          269000,
          269667,
          285000,
          269667,
          271667,
          270333,
          273333,
          269667,
          269667,
          269000,
          269333,
          268333,
          269000,
          269667,
          269000,
          270333
        ]
      },
      "suite": "algorithms",
      "warmup_samples_ns": [
        273667,
        271000,
        273333,
        273333,
        274333
      ],
      "workload": "tak-branching"
    },
    {
      "artifact_bytes": null,
      "cold_start_ns": 21705062,
      "first_call_ns": 4778000,
      "peak_rss_bytes": null,
      "reason": null,
      "runtime": "sbcl-prepared",
      "status": "ok",
      "steady_state": {
        "samples_ns": [
          4780667,
          4763667,
          4756000,
          4748667,
          4789333,
          4764667,
          5262000,
          4962333,
          4647000,
          4696333,
          4683333,
          4614667,
          4622667,
          4591000,
          4661000,
          4718000,
          4697333,
          4740333,
          4705000,
          4704000,
          4695333,
          4685333,
          4704333,
          4704000,
          4942667,
          4826000,
          4624333,
          4623667,
          4699333,
          4709333
        ]
      },
      "suite": "algorithms",
      "warmup_samples_ns": [
        4780667,
        4763667,
        4756000,
        4748667,
        4789333
      ],
      "workload": "collatz-range"
    },
    {
      "artifact_bytes": null,
      "cold_start_ns": 21705062,
      "first_call_ns": 39000,
      "peak_rss_bytes": null,
      "reason": null,
      "runtime": "sbcl-prepared",
      "status": "ok",
      "steady_state": {
        "samples_ns": [
          38333,
          37667,
          37667,
          37333,
          37000,
          37000,
          36667,
          37000,
          37000,
          37000,
          37000,
          37333,
          37000,
          37333,
          36667,
          38333,
          37333,
          37000,
          37000,
          38333,
          37000,
          37333,
          39000,
          38667,
          38333,
          38667,
          38333,
          38000,
          38000,
          39000
        ]
      },
      "suite": "algorithms",
      "warmup_samples_ns": [
        38333,
        37667,
        37667,
        37333,
        37000
      ],
      "workload": "matrix-multiply"
    },
    {
      "artifact_bytes": null,
      "cold_start_ns": 29722187,
      "first_call_ns": 23000,
      "peak_rss_bytes": null,
      "reason": null,
      "runtime": "chez-prepared",
      "status": "ok",
      "steady_state": {
        "samples_ns": [
          1333,
          667,
          1000,
          667,
          1000,
          667,
          1000,
          667,
          1333,
          667,
          667,
          1000,
          667,
          1000,
          667,
          1000,
          667,
          667,
          667,
          1000,
          667,
          667,
          1000,
          667,
          1000,
          1000,
          1000,
          667,
          1000,
          667
        ]
      },
      "suite": "algorithms",
      "warmup_samples_ns": [
        1333,
        667,
        1000,
        667,
        1000
      ],
      "workload": "sieve-array"
    },
    {
      "artifact_bytes": null,
      "cold_start_ns": 29722187,
      "first_call_ns": 717000,
      "peak_rss_bytes": null,
      "reason": null,
      "runtime": "chez-prepared",
      "status": "ok",
      "steady_state": {
        "samples_ns": [
          684667,
          683333,
          683333,
          681667,
          684000,
          683667,
          680667,
          684333,
          695333,
          723667,
          690000,
          705000,
          689333,
          689000,
          702000,
          699000,
          709000,
          705000,
          702667,
          698000,
          700333,
          702333,
          704333,
          704000,
          702000,
          702333,
          698000,